Brand,Price,Rating,Link
Brave shop New Arrivals Fashion Sneakers Men's Running Shoes Comfortable Outdoor Casual Hiking Shoes,1269,(151),https://www.kilimall.co.ke//listing/2686490-brave-shop-new-arrivals-fashion-sneakers-mens-running-shoes-comfortable-outdoor-casual-hiking-shoes?skuId=18905899
Brave shop New Arrivals Fashion Sneakers Men's Running Shoes Comfortable Outdoor Casual Hiking Shoes,1099,(30),https://www.kilimall.co.ke//listing/1000268764-brave-shop-new-arrivals-fashion-sneakers-mens-running-shoes-comfortable-outdoor-casual-hiking-shoes?skuId=10000869556
Brave shop New Arrival Fashion High Quality Men's Board Shoes Student Canvas Shoes Outdoor Casual Hiking Shoes Running Shoes Sneakers,1199,(119),https://www.kilimall.co.ke//listing/2765336-brave-shop-new-arrival-fashion-high-quality-mens-board-shoes-student-canvas-shoes-outdoor-casual-hiking-shoes-running-shoes-sneakers?skuId=19168642
Brave shop New Arrivals Fashion Sneakers Men's Running Shoes Comfortable Outdoor Casual Hiking Shoes,999,(61),https://www.kilimall.co.ke//listing/1000181346-brave-shop-new-arrivals-fashion-sneakers-mens-running-shoes-comfortable-outdoor-casual-hiking-shoes?skuId=10000471565
LifeCare New Arrival Fashion Breathable  High Quality Men's Sport Shoes Outdoor Casual Hiking Shoes Fashion Sneakers,1199,(141),https://www.kilimall.co.ke//listing/2686002-lifecare-new-arrival-fashion-breathable-high-quality-mens-sport-shoes-outdoor-casual-hiking-shoes-fashion-sneakers?skuId=18904252
Brave shop New Arrival Fashion High Quality Splicing Men's Board Shoes Student Canvas Shoes Outdoor Casual Hiking Shoes Sneakers,1299,(178),https://www.kilimall.co.ke//listing/2634811-brave-shop-new-arrival-fashion-high-quality-splicing-mens-board-shoes-student-canvas-shoes-outdoor-casual-hiking-shoes-sneakers?skuId=18708401
LifeCare New Arrivals Fashion Sneakers Men's Running Shoes Comfortable Outdoor Casual Hiking Shoes,799,(3),https://www.kilimall.co.ke//listing/1000268773-lifecare-new-arrivals-fashion-sneakers-mens-running-shoes-comfortable-outdoor-casual-hiking-shoes?skuId=10000869579
Brave shop New Arrivals Men's Casual Breathable Sports Shoes Soft Soled Hiking Shoes Students Fashion Sneakers Athletic Shoes,1199,(27),https://www.kilimall.co.ke//listing/1000180607-brave-shop-new-arrivals-mens-casual-breathable-sports-shoes-soft-soled-hiking-shoes-students-fashion-sneakers-athletic-shoes?skuId=10000468514
LifeCare New Arrival Fashion High Quality Splicing Men's Board Shoes Student  Shoes Outdoor Casual Hiking Shoes Sneakers,1299,(62),https://www.kilimall.co.ke//listing/2711415-lifecare-new-arrival-fashion-high-quality-splicing-mens-board-shoes-student-shoes-outdoor-casual-hiking-shoes-sneakers?skuId=18994176
Brave shop Ladies Shoes High Quality Fashion Women Athletic Shoes Thick-soled Women shoes Increase Casual Shoes Lace-up Girls’ Sport Shoes,999,(637),https://www.kilimall.co.ke//listing/2299065-brave-shop-ladies-shoes-high-quality-fashion-women-athletic-shoes-thicksoled-women-shoes-increase-casual-shoes-laceup-girls-sport-shoes?skuId=17204951
Brave shop New Arrivals Women's Casual Sports Shoes Girl's Shoes Fashion Breathable Soft Soled Shoes Ladies' Athletic Running Shoes,699,(46),https://www.kilimall.co.ke//listing/1000181302-brave-shop-new-arrivals-womens-casual-sports-shoes-girls-shoes-fashion-breathable-soft-soled-shoes-ladies-athletic-running-shoes?skuId=10000471383
Brave shop New Arrival Fashion Splicing Oxfords Business Shoes Mens Casual Loafers Driving Shoes Men's Party Slip-Ons,1099,(130),https://www.kilimall.co.ke//listing/2855688-brave-shop-new-arrival-fashion-splicing-oxfords-business-shoes-mens-casual-loafers-driving-shoes-mens-party-slipons?skuId=19422286
LifeCare New Arrivals Men's Casual Sports Shoes Men's Shoes Breathable Soft Soled Shoes Boy's Running Shoes,899,(40),https://www.kilimall.co.ke//listing/1000181329-lifecare-new-arrivals-mens-casual-sports-shoes-mens-shoes-breathable-soft-soled-shoes-boys-running-shoes?skuId=10000471576
LifeCare New Arrival Sports shoes High Quality Men's Hiking Shoes Running Shoes Outdoor Casual  Shoes,1199,(33),https://www.kilimall.co.ke//listing/1000181310-lifecare-new-arrival-sports-shoes-high-quality-mens-hiking-shoes-running-shoes-outdoor-casual-shoes?skuId=10000471397
Size 41-45 Men's fashion sneakers mesh surface outdoor sports shoes Students comfortable  shoes Boys walking shoes hiking shoes running shoes Casual shoes,1299,(560),https://www.kilimall.co.ke//listing/2663257-size-4145-mens-fashion-sneakers-mesh-surface-outdoor-sports-shoes-students-comfortable-shoes-boys-walking-shoes-hiking-shoes-running-shoes-casual-shoes?skuId=19641940
Women's Butterfly embroidery white shoes ladies' flat shoes girls sneakers athletic students casual breathable shoes sports shoes artificial Pu leather,999,(299),https://www.kilimall.co.ke//listing/2466865-womens-butterfly-embroidery-white-shoes-ladies-flat-shoes-girls-sneakers-athletic-students-casual-breathable-shoes-sports-shoes-artificial-pu-leather?skuId=18056809
Men’s White Shoes women’s Breathable Rubber Low Upper Sport Shoes  casual Sneaker women’s  PU leather shoes boys Fashion Sneaker Classic lace-up sneakers,999,(729),https://www.kilimall.co.ke//listing/2116794-mens-white-shoes-womens-breathable-rubber-low-upper-sport-shoes-casual-sneaker-womens-pu-leather-shoes-boys-fashion-sneaker-classic-laceup-sneakers?skuId=15977246
SXCHEN New Men's Shoes Sneakers Forrest Gump Shoes Men's Slip-on Driving Dad Shoe Fashion Half Slippers Bean Shoes for Men Shoes Slippers Men Versatile Casual Shoes Athletic Walking Version Trendy,1199,(35),https://www.kilimall.co.ke//listing/2784815-sxchen-new-mens-shoes-sneakers-forrest-gump-shoes-mens-slipon-driving-dad-shoe-fashion-half-slippers-bean-shoes-for-men-shoes-slippers-men-versatile-casual-shoes-athletic-walking-version-trendy?skuId=10000415384
SXCHEN Women's Shoes Athletic Running Octopus Ladies Shoes Couple Mesh Casual Shoes Sneakers Socks Shoes Women's Korean All-match Running Shoes Party Office Girl Lovers Gift Latest Shoes Mom Shoe,1199,(154),https://www.kilimall.co.ke//listing/2855341-sxchen-womens-shoes-athletic-running-octopus-ladies-shoes-couple-mesh-casual-shoes-sneakers-socks-shoes-womens-korean-allmatch-running-shoes-party-office-girl-lovers-gift-latest-shoes-mom-shoe?skuId=19421437
SXCHEN New Women's Shoes Sneakers Women Season All-Match Shoes Ladies Platform Ladies Shoes Running Shoes Girls Sneakers Buy a Size Larger than usual Casual High daddy Work party Gift Holiday,1199,(231),https://www.kilimall.co.ke//listing/2146195-sxchen-new-womens-shoes-sneakers-women-season-allmatch-shoes-ladies-platform-ladies-shoes-running-shoes-girls-sneakers-buy-a-size-larger-than-usual-casual-high-daddy-work-party-gift-holiday?skuId=17588936
Air Cushion Men Sport Running Shoes Fashion Sneakers Jogging Trainers Casual Lace-up Breathable Mesh Outdoor,1998,(1581),https://www.kilimall.co.ke//listing/2435643-air-cushion-men-sport-running-shoes-fashion-sneakers-jogging-trainers-casual-laceup-breathable-mesh-outdoor?skuId=10001049274
Men Shoes Sneaker Sport Shoes Running Shoes PU Leather Athletic Casual Shoes for Men Discount On Sale,1029,(1284),https://www.kilimall.co.ke//listing/2088079-men-shoes-sneaker-sport-shoes-running-shoes-pu-leather-athletic-casual-shoes-for-men-discount-on-sale?skuId=15693858
New arrival Women's casual sports shoes Ladies round toe mesh shoes Students fashion sneakers running shoes girls breathable gym shoes comfortable walking shoes,1099,(106),https://www.kilimall.co.ke//listing/2845405-new-arrival-womens-casual-sports-shoes-ladies-round-toe-mesh-shoes-students-fashion-sneakers-running-shoes-girls-breathable-gym-shoes-comfortable-walking-shoes?skuId=19395225
New arrivals men's athletics shoe driving shoes Dad's non-slip work shoes boy's walking shoes breathable casual shoes students running shoes comfortable sneakers,999,(100),https://www.kilimall.co.ke//listing/3004385-new-arrivals-mens-athletics-shoe-driving-shoes-dads-nonslip-work-shoes-boys-walking-shoes-breathable-casual-shoes-students-running-shoes-comfortable-sneakers?skuId=19826484
New Arrivals Kids and Men Football Boots Non-slip Light Sport Shoes Outdoor Footwear Sneakers Soccer Shoes Black Color,1999,(137),https://www.kilimall.co.ke//listing/2331874-new-arrivals-kids-and-men-football-boots-nonslip-light-sport-shoes-outdoor-footwear-sneakers-soccer-shoes-black-color?skuId=17411803
Size 38-42 Women's shoes mother walking shoes breathable set feet ladies mesh sports shoes casual thick sole fashion running shoes girls shoes students sneakers,999,(59),https://www.kilimall.co.ke//listing/3092577-size-3842-womens-shoes-mother-walking-shoes-breathable-set-feet-ladies-mesh-sports-shoes-casual-thick-sole-fashion-running-shoes-girls-shoes-students-sneakers?skuId=20054738
Women's lace-up sports sneakers ladies comfortable athletic casual running shoes girls soft soled cloth shoes students flats shoes sports shoes Ladies' breathable casual shoes,899,(284),https://www.kilimall.co.ke//listing/2603848-womens-laceup-sports-sneakers-ladies-comfortable-athletic-casual-running-shoes-girls-soft-soled-cloth-shoes-students-flats-shoes-sports-shoes-ladies-breathable-casual-shoes?skuId=18889007
Lady Sport Shoes Fitness Athletic Sneakers Women Running ladies shoes girl Women Athletic women shoes ladies girl Fast delivery within 1-5 days,690,(255),https://www.kilimall.co.ke//listing/2123171-lady-sport-shoes-fitness-athletic-sneakers-women-running-ladies-shoes-girl-women-athletic-women-shoes-ladies-girl-fast-delivery-within-15-days?skuId=17745421
Men's Shoes Athletic Basketball Shoes Sports Shoes Running Shoes New Basketball Shoes Large Size Sports Shoes Youth Mid-Top Shoes Sports Shoes Sneakers,1899,(11),https://www.kilimall.co.ke//listing/1000241117-mens-shoes-athletic-basketball-shoes-sports-shoes-running-shoes-new-basketball-shoes-large-size-sports-shoes-youth-midtop-shoes-sports-shoes-sneakers?skuId=10000701907
ZZQLM 2024 New Fashion Sneakers Comfortable Low Top Casual Men's Shoes Non Slip Hiking Shoes,1399,(638),https://www.kilimall.co.ke//listing/2575412-zzqlm-2024-new-fashion-sneakers-comfortable-low-top-casual-mens-shoes-non-slip-hiking-shoes?skuId=18525942
Shoes Women Shoes Ladies Shoes Athletic Shoe s Women&apos;s Breathable Antiskid Sneakers Women Sneakers,599,(349),https://www.kilimall.co.ke//listing/1954528-shoes-women-shoes-ladies-shoes-athletic-shoe-s-womenaposs-breathable-antiskid-sneakers-women-sneakers?skuId=14058303
New Arrivals men's shoes fashion sneaker casual sports shoes boy's PU Artificial leather lace-up single shoes students low top shoes running shoes,999,(79),https://www.kilimall.co.ke//listing/1000101189-new-arrivals-mens-shoes-fashion-sneaker-casual-sports-shoes-boys-pu-artificial-leather-laceup-single-shoes-students-low-top-shoes-running-shoes?skuId=10000223922
Shoes Men Shoes Sneakers Athletic Casual Shoes for Men Sport Shoes Rubber Shoes New Fashion Discount On Sale,1019,(1306),https://www.kilimall.co.ke//listing/1983563-shoes-men-shoes-sneakers-athletic-casual-shoes-for-men-sport-shoes-rubber-shoes-new-fashion-discount-on-sale?skuId=14392842
SXCHEN Women's Shoes Sneakers Ladies Shoes American Thick Bottom Color Matching Sports Shoes Casual Low Top Sports Shoes Party Office Girl Mom Shoe Lovers Gift Latest Shoes Wedge Shoes Ladies,1799,(39),https://www.kilimall.co.ke//listing/2873709-sxchen-womens-shoes-sneakers-ladies-shoes-american-thick-bottom-color-matching-sports-shoes-casual-low-top-sports-shoes-party-office-girl-mom-shoe-lovers-gift-latest-shoes-wedge-shoes-ladies?skuId=19473144
Women's shoes casual sports shoes Mother gym shoes running shoes ladies' shoes girls fashion athletic shoes students shoes sneaker,799,(11),https://www.kilimall.co.ke//listing/1000249089-womens-shoes-casual-sports-shoes-mother-gym-shoes-running-shoes-ladies-shoes-girls-fashion-athletic-shoes-students-shoes-sneaker?skuId=10000747016
Ladies Shoes Women Shoes Sneakers Sport Shoes  Athletic Old Dad Shoes Thick Sole Heightening Walking Shoes Breathable Casual Running Sneakers,1299,(268),https://www.kilimall.co.ke//listing/2349817-ladies-shoes-women-shoes-sneakers-sport-shoes-athletic-old-dad-shoes-thick-sole-heightening-walking-shoes-breathable-casual-running-sneakers?skuId=17489562
